name,negative_description,positive_description
Self-Worth,Deep sense of worthlessness feeling fundamentally flawed,Healthy self-esteem recognizing inherent value and accepting imperfections
Future Outlook,Hopelessness seeing no possibility for positive change,Optimism ability to envision and work toward better possibilities
Social Impact,Feeling like a burden believing others would be better off without you,Recognizing contributions understanding your positive impact on others
Emotional Resilience,Overwhelming pain feeling unable to cope with emotions,Ability to navigate difficult feelings understanding emotions are temporary
Self-Reflection/Growth,Excessive guilt and shame harsh self-judgment,Self-compassion learning from experiences embracing personal development